,Rating,Review,Length
869,4,didnt realize small memory old phone tmobile touch 3g slide mean thing slow accept download stuff anymore figure later memory might small sure look sandisk memory card amazon order one surprise much cheaper see store instal phone work like champ still use phone different download much memory,47
870,4,upon insert hc 16gb card motorola doid x galaxy s3 music would play chop sometimes file would work card clear problem allow put whole music collection phone complaints far job,30
871,4,use card 734 igo gps gps come couple gb onboard quickly use wince 6 gps software since device also play mp3s want spacei read meager documentation come device see could handle 16gb card pretty sure would handle 8gb card one never know everchanging specifications unfortunately documentation device meager write pidgin englishok ill buy give try worst swap 8gb card different device hopefully handle 16gb cardwell make long story short late eh 16gb card work fine put bunch mp3s card put device sure enough recognize play themso pretty much do deal price ease use name brand recommend little card,98
872,4,stay away nonamebrand flash memory get quality sandisk ive own dozens usb flash drive compactflash sd microsd card years workas particular model 64gb microsd galaxy note pro 122 tablet 16gb microsd galaxy note 2 smartphonepopped em devices recognize problem dragdrop copypaste file internal storage card without issue fly plug computers always recommend sandisk anyone look expand storage capacity,58
873,3,reach read speed 24mbs write speed 18mbs optimal situationother speed everything fine id like say color quite good thing microsd could small put away second easily disappear bright read light grey color much easier find blend common backgroundalso quality look good like microsd card unibody design cannot tell appearance circuit sd card adapter come quite good quality tooin summery good design good quality satisfy speed judgement call say worth totally go,71
874,4,ive try card go back compact flash card rule every single time wind come back sandisk wont certify card certain speed unless sustain speed every single sandisk product ive ever own last last last quit use sandisk products didnt make sense keep use 256mb 512mb thumbdrives flash card still work really slowly still work fine heck use time ever sandisk fail could trace failure back something fault sandisk product soooo buy sandisk always get moneys worth,76
875,3,use security camera mount outside job record picture video first one fail issue second one seem work well,18
876,4,purchase grandson tablet actually purchase 2 love game want sure plenty space save everything want must work ive hear complaints,20
877,4,excellent quality item,3
878,4,buy upgrade 16 gb android phone need extra space nice handy accommodate picture videos take phone among things without worry run space package good arrive time amazon prime thats something dont worry,32
879,4,work great add memory lg phone sandisk brand trust worthyi recommend highly,12
880,4,marvelous fix camera automatically recognize great storage camera use,9
881,4,memory card work nook canon camera choose disk hold lot picture ship earlier expect,14
882,3,great card lot storage money dont hesitate buy steal amount storage get,12
883,4,good card high quality material nice design new model product brand name famous n reliable recommend good price,18
884,4,use phone watch hq videos run apps unlike lower class non hc card one never stutter,16
885,2,3 months would read use sort card readers computers internals go completely dead strange product company guess happen may happen since high capacity would mean susceptible become corrupt would buy maybe 16gb,32
886,3,20 cant complain speed much put little guy super mini microsd reader stick truck stereo mp3 storage use usb3 memory card reader populate card music truck stereo seem happy,29
887,4,use note2 suppose extend storage capacity great phone,8
888,4,purchase add memory new android tablet san disk good reputation never one fail purchase ultra speed purchase good price would recommend item anyone need sd micro memory,27
889,4,complain awesome card great performance degradation speed far well bad sectors,11
890,3,utilize card much hop would cannot comment much speed tablet asus transformer infinity certainly plenty space,16
891,4,3 far favorite microsd card fast far problems,8
892,0,run several test computer phone write 6mb read 6 10 depeneding mood buy replace generic 32gb class 10 card lose dang small drop could find card actual write 11 12mb read 20mb go sandisk phone come class 2 perform like class 6 waste time refund item,46
893,4,product ship fast actually come days early read people problems card get first thing format also make sure device compatible sdhc card problems fast readwrite speed little 29 gb actually available storage please,33
894,2,last 8 months daily use android phone yesterday stop perform write fail altogether work read incredibly fast write pretty good well,21
895,0,yeah ultra hot could get devices recognize card finally use usd reader try format wouldnt format burn finger remove others also post maybe bad many perhaps counterfeit dont know hassle return isnt worth 10 may save,36
896,4,think 32 gb would work 32gb asus pad work great iti want space make easier put vids way pics,19
897,4,look expand memory galaxy note 3 buy one class 10 micro sd card good enough speed smart phone best way upgrade memory phone,23
898,4,need video capacity canon camera sandisk 32 gb micro card include adapter exactly right tool job ive several sandisk memory card past never glitch kindhighly recommend,26
899,4,get use mother digital camcorder offer good value adapter insure card use anywhere mom happy extra capacity card provide film niece nephew,22
900,3,micro sd card extremely fast write read file fast even slow usb 20 interface mechanically card tight adapter need screw driver get back adapter try another two adapters result tight fit user plan use normal size sd card excellent card one plan switch 34phone34 micro sd card camera normal size sd card tight fit might problem vender service excellent shipment faster expect would buy even tight fit excellent value fast card camera shoot burst mode without slow write card,79
901,3,receive promise insert table acknowledge thereguess work expect also,9
902,3,put tablet far nothing complain see long one last,9
903,3,sandisk make great memory chip decent price recommend name brand error frequency,12
904,3,work great far gopro fill card pretty quick record 1080p get 64gb week later,14
905,3,replace 32g msd card aware card speed issue result start loose video pics card become corrupt little research find card write speed issue make sense replace card yes work lose pic vid since,33
906,3,love 32gb micro sd card put samsung galaxy note phone return 3 day trip use cameravideo recorder keep hd quality whole time problems reason give 5 star rat actually 29gb space instead 32 norm please excuse ignorance,37
907,4,ive never problem sandisk memory products use 34ultra34 compact flash camera one cut cloth great product problems continue demand sandisk,20
908,4,review sandisk card work store picture items phone zero problems,10
909,4,card use galaxy s4 read write speed good card come ready use box,13
910,4,use galaxy tab 3 great issue,6
911,4,order several much cheaper best buy use gopro work great prefer several 32gbs 64gbs case get corrupt arent lose much data,21
912,4,great memory card get one amazons daily deal terrific price get ready upgrade cell phone want larger capacity memory card ready go need,23
913,3,work fine virgin mobile htc evo v phone didnt recognize first format good,13
914,4,32 gb top 16gb samsung s4 memory card adapter include fit exactly phone price lower buy another phone store,19
915,3,get upgrade surface pro 2s storage work nicely store bunch mp3s game steamit work well game run fine boot pretty quick one issue instal game sometimes card would vanish drive id pop get go however feel like could software relate nothing like happen play gamebest idea install game surface move file manually card 34tell steam uninstall game34 erase list hit install point folder card itll spot file download things bam worksabout card wouldnt rely multitasking thing mean youre play music card install game time fast 1 thing many,88
916,3,card work great quite several devices one bough 2012 suddenly die go sandisk website chat support tech try quick troubleshoot five minutes ask info rma process quick easy like say one suddenly die idea luckily didnt anything important time one ive ever fail like say rma process breeze really like card customer service great reference run card samsung galaxy sii hercules 32 gb motorola droid sholes 16 gb motorola droid 3 solana 32 gb samsung galaxy note 101 2012 gtn8013 32 gb note one fail also gopro run golden sandisk card twice price continue buy card regardless isolate incident,99
917,3,mean obvious lie whole 64gb thing get maybe 60 luckyseems work ok far,13
918,4,take lot pics phone samsung 4s help free space phone ive issue far,13
919,4,exactly neededtook old 32 gb card samsung galaxy s4 put digital recorder buy new 64 gb card phoneas advertise fast stable try transfer many apps external media phone free memory phone one problem yethighly recommend,35
920,4,always come straight amazon memory card need sandisk one reliable name category lot usable memory minimum cost outlay downside product max storage compatible devices,24
921,4,best class 10 microsd card compare card perform card come sd microsd card converter nice plus card come preformatted work android devices windows devices cant get much easier thatgreat card fast ship complaints,33
922,4,would recommend friends work expect transfer speedy always fan sandisk make product quality,13
923,4,purchase school district havent hear complaints would assume everything okay,10
924,4,product great phone doesnt lock anymore wonder class 10 find mean run faster normal black micro sd card class 1 2 smart phone come withthis card make difference fast get internet,31
925,4,purchase sandisk 16gb class 2 microsdhc needle say didnt see need purchase one begin read class 10 card really process record faster record picture faster didnt believe put test use samsung galaxy siii instal record videos take picture play music also download pdfs work document every test far faster class tell difference class close would say dont settle lower class cheaper wait go sale know well purchase one reason get card lower class,73
926,4,great price fast speed class 10 adapter like color memory card much go wrong,14
927,4,buy samsung galaxy legend phone store picture videos work like charm,11
928,4,work great phonei think may buy lot productmaybe 64gb,9
929,4,good product like brand keep buy camares phone tablets,9
930,3,cant give much feedback end return look ideal memory mircosd card gopro find better model end film one event card pretty good end lag time though briefly,27
931,4,well know brandname high speed good price lot storage space lot use buy micro adapter use flash drive movies,19
932,4,use upgrade storage phone tablet simple get fast transfer speed simply work work well go card brand reliability performance,19
933,0,ive memory card 35 weeks recently start reset intermittently lose contact cell phone memory lose erase everything find return date past im stick peice memory card cant damn thing thank lot nothing never buy direct againalso didnt realize suppose adapter wow heck,42
934,0,card work droid razr phone whenever try transfer file card make phone freeze completely try every possibility get work type card worthless work due high capacity phone every workaround try get card work still cause phone freeze,37
935,4,use add capacity android power hp slate 734 tablet reformat ntfs work work great note many devices work 32 gb card check specs order,24
936,4,get sd card trip hawaii could gopro everything get 4 hours video 1080hd work great complaints highly recommend,18
937,4,buy one 32gb galaxy s4 another canon t3i work problem detect format box sandisk one reliable card manufacturers opinion ive go sell lot cheaplesser sd card throughout years almost manufacturer failures date havent issue sandisk ive buy card wife family members everyone s4 far theres issue use mine heavily everyday new music movies 69 months havent failuresas far speed go use dd usb3 card reader record almost 14mbs write speed 33mbs read speed make far fastest class 10 card ive sell 34extreme34 versions card even faster integrate devices wont see speed increase benefit,93
938,4,buy 64gb version card increase storage capacity samsung galaxy s3 use store picture video shoot phone never issue card keep 1080p video phone shootsspeed test galaxy s3 w sd card testerwrite 96 mbsread 24 mbs,35
939,4,must listen lot music gowish make 128gb model,8
940,4,buy expand storage space galaxy s4 surface tablet windows rt perform well transfer small file take problems record video hd phone totally recommend largest card devices take,27
941,4,brilliant little card good transfer speed highly recommend exactly look great price,12
942,4,good price good quality put phone extra storage hold well since get,12
943,4,buy card new samsung galaxy note 3 didnt anything put card phone format need transfer picture videos along 15 gb music everything load quickly still ton memory leave store whatever want need buy amazon much better price could find anywhere else order amazons frustration free package pull tab package card hand less ten second recommend anyone want fast card lot memory,61
944,4,buy item base review recommendations installation extremely easy card buy 2 ship perfect condition like others note actual add storage 29 gb buy via amazon huge discount oppose local instore optionsshipping perfect would recommend product friendsfamily,36
945,4,scandisk micro sd work well never problem product brand short couple word sorry,13
946,3,card fast cheap use canon s100 camera shoot raw format picture 1080 video work flawlessly im currently use old mytouch phone storagegreat product great price,25
947,4,card great save lot picture file card card work great phone,11
948,3,useful surface pro increase capacity 128gb also use backup case something go wrong,13
949,4,yee maximum space allow gopros knowledge older versions like hero 3 larger sd card micro sd card allow great price great quality hd picture movies get,26
950,4,amaze keep make bigger storage card price go wow nice hold lot stuff,13
951,4,sure say anything cover previous 13660 review already write memory card add commentits great card work great camera storage capacity need price good get,24
952,3,special price could let goi buy card phone gopro camera ideal,11
953,2,work great asus tablet 3 months completely die recognize devices diedi rmad sandisk prcess painless replacement arrive within days email return label thru up send last weekwhen work performance great access time fast lag read write dataif get make sure back data incase failure tablet sync cloud service lose anything purchase sandisk items never issue,55
954,4,galaxy note 101 necessary use tablet much dont get smaller card,11
955,0,card work galaxy s3 right bat need format anything 2 weeks watch video phone lock phone show card damage unable copy anything 100mb card view photos gallery also lock phone amazon customer service great however send new card update review able use new one least month without errorsupdateafter second card weeks also issue even worse card completely unreadable lock card show 5 gb data use could access via phone computer send one back go back trusty 16gb card,78
956,4,use samsung galaxy s4 work well good readwrite speed please card,11
957,4,put phone format move data 16gb microsd pop phone last 4 months problems pick 27 buck good deal,18
958,4,work fine im think get 64gb tablet later dont much say except buy,13
959,4,get replace old class 4 micro sd card new phone plenty space fast,13
960,4,use gopro hero 3 hd record high definition sport video chip well would definitely recommend,15
961,4,buy new camera price incredible big fan sandisk come memory card course buy one camera unsure fit new camera samsung wb30f turn fit storage capacity incredible picture lover whenever able take picture give 4000 picture maybe even cant remember great price great storage capacity cant go wrong,47
962,2,great card issue gopro 3 one maybe firmware update help situation,11
963,4,pick deal day issue put phone connect phone galaxy s4 computer drop music picture folder everything quick easy,18
964,4,work fine gopro buy months ago work great make,9
965,4,issue plug playi run benchmarks store camera video data card include lot high definition daily roads dashboard cam footage theres issue cache temp video file store ones opt save due apparently speed capacity cardthe con fact wait long buy one,40
966,4,youre get card mean youre 1337 like least aspirecarry young diamondcarry,11
967,4,cant beat price one 64gb sd card reader use go pro 3 work fantastic,14
968,4,arrive doa amazon send another one right away perfect use gopro hero 3 must shoot 1440 better video order keep updo need 64gb maybe maybe need class 10 buy never look back,32
969,3,sure point review stanard 32g memory card purchase tablet work fine,11
970,4,continually amaze fact tiny bite almost nothing powerful however caution anyone buy micro card gopro extremely easy lose highly recommend,20
971,4,true name sandisk best use smartphone guess overkill many say type micro sd card mean dslrs im go quality something would last long time thats go highly recommend,28
972,4,use product samsung galaxy s3 sony xperia z1 perform without fail add much need memory phone take picture video would recommend android phone owners,24
973,4,add lot storage space new nokia lumia 1520 nice package get quickly able install easily phone recognize immediately turn phone insert sd come adapter didnt need convert micro sd,29
974,4,amaze much storage fit small form factorremember 15 mb floppy disk heck thing soooo small might lose itits like pinky nail size smalland hold 64 gb awesome,27
975,0,good repeatedly self eject new galaxy s4 return exchange refundbought two one work well one doesnt guess defectivei two gal s4is buy 2,23
976,4,sandisk great brand fail purchase several think bad luck sure amazon replace,12
977,4,san disk always good brand work well samsung galaxy phone tablets,11
978,3,use replace exist transcend microsdhc card phone find piece equipment access apparently older firmware devices recognize 64 gb sd one trick find able format tablet move phone initially phone report corrupt sd issue reliable stable lightning fast take two hours copy photos music onto,44
979,4,big fan sandisk even price flash decrease cant compare brand never reason switch minor price variations compel performancequality never issue many years sue brand,24
980,4,seem work fine load 13 full delete file nothing unexpected happen,11
981,4,dashcam didnt come memory card get thisthis card work well fairly demand capacity thats like way drivers use dashcams ive get mine set 10 minute loop mean new data write card far card hasnt quit im please,37
982,4,phone memory reside play video media fast sandisk always make excellent products memory leader,14
983,3,would recommend memory card anyone work well tablet problems,9
984,4,work like suppose quick efficient stable reasonably price far good put camera go,13
985,4,carry two one camera one camera case pocket dont lose never run memory enough capacity 4mbimage shoot shoot shoot download end day want thousands picture one couple batteries see wasabi review never stop shoot,34
986,4,good memory gopro go 32gb brother two gopro cameras say never fill 32 go 64 anyway versatile enough go phone camera order two,23
987,4,give item five star rat work well use micro standard format,11
988,4,expect brand instal tablet moment arrive work perfectly,8
989,1,give card october add new samsung galaxy s3 thrill copy ton music onto card use phone mobile ipod substitute leave ipod classic desktop speaker system cradleeverything work fine couple weeks ago start get message seem say remove insert memory card course hadnt touch days ago phone tell card contain unsupported file need reformat well try reformatting nothing nothing pull memory card reset phone reinserted card nothing try card adapter 3 computers wasnt even visiblei call sandisk tech support didnt take terribly long convince problem quickly offer two 16 gb card replacement literally laugh get disturb sense something require try thats lousy business practice bounce around time agree send rma ship label duly send card couple days ago frank idea might receive replacementif werent already grip sandisk would buy another card fact 10 comment negative indication real quality control problem 10 fail rate simply unacceptable product thisupdate well give sandisk credit customer support return card use supply up label tuesday receive replacement up follow monday thats good service however increase suspicion offer two 16 gb 32 gb card stock stock sure get stock big hurry event ive up rat two star,190
990,4,buy grandson work new tablet hes happy much im sure prefer tablets laptops give function need memory card ensure keep data move next tablet whenever need,26
991,4,get phone camera cant decide use first lol depend feel like carry,12
992,4,afraid buy many comment say doesn8217t work hero3 high resolutions video case,12
993,4,mean 64gb memory card price right catch sale big ole memory card like sandisk havent trouble,16
994,4,love work great fairly cheap compare 64gb sd card without sacrifice quality sandisk always make great products,17
995,4,give galaxy s4 plenty memory good price problem first one amazon send replacement next day work perfectly would recommend anybody,20
996,4,buy digital recorder memory card slot card work perfectly problems file newhome definitely worth price meet expectations data storage,19
997,4,much say memory card work great go pro hero 3 silver edition use 960x60 card give 85 hrs video record time definitely good buy,24
998,4,32 gig microsd card cost less dollar per gig class 10 even importantly test class 10 operate class 10 say lot compare lot 34class 1034 card,26
999,4,im nerd hoarder wait year memory 64gb want carry extensive digital comic collection tablet longer wait happy nerd,18
1000,4,great price work flawless note 3 love glad purchase memory card must expand memory phone,15
1001,4,call gopro recommend specific card say 64gb card cause problems run gopro hero3 2x batteries attach still wont fill card even hd videoi go 2 week surf voyage across hawaii 2 badboys document whole trip,35
1002,2,get job do gopro thats good never like small actual card due nature might get lostthen thats game price amaze get two price half one,25
1003,4,card hold everything think barely fill work fast lag access card let take hd video straight onto,17
1004,4,able plug use format utility work fine galaxy s3 every ounce rip cds phone 32gb spare much else say,19
1005,4,64 32gb card use phone well gopro cameras reliable work well right box problems complaints,15
1006,4,couple ive test several devices use card mainly mobile devices 64 gb perform well galaxy note 2 galaxy note 3 ive test transfer rat within prescribe range fastest class 10 card sufficient store picture movies songs im able play songs movies card without delay,44
1007,4,purchase cheaper cellphone great price item make perfect accessoryalternative buy much expensive phoneclass 10 speed mean dont worry lag access file issue ever format card work perfectly phone samsung axiom right box,32
1008,4,use samsung galaxy tab 3 101 work seamlessly use store movies watch travel havent issue yet transfer speed great play movies card problem,23
1009,4,instal galaxy s4 work greati want wait price go wish 128gb come soon buy,14
1010,4,purchase along nifty minidrive use time machine backup macbook air 1334 perfect expansion,13
1011,4,card pretty cheap tiny physically large digitally least mid 2014 get extend storage capacity surface pro 3 do store file dont take precious space dedicate towards program since surface pro 3 full windows 8 also double storage device gopro hero 3 black faster card prevent freeze issue size micro sd card great job store data like videos photos music fit devices move micro sdxc phone tablets beloved surface pro 3 highly recommend card need extend storage device reconsider faster card want record video straight like gopro,86
1012,0,buy able load music verizon lg android phone spend hours add music card put android phone phone read anything memory card memory card 8gb 32gb work fine must flaw memory card also memory card get stick android phone slot use utility knife thin blade pull card,46
1013,3,things would like say sand disk ultrait best dang sd card ive ever use right let honest put phone would extra storage photos videoshowever really good sit phone dont anything itseriously access everything connect phone usb essentially like phone another hard drive,42
1014,4,love memory card upgrade memory phone 2gb stock card transfer rat card phone back way faster capacity great ive replace ipod music phone well game dont use itunes interface drag drop oh waterproof like phone say,36
1015,4,brand prove reliable easy work versatile use android devices well cameras nothing permanent try back file serve well couple years,20
1016,4,order one 2gb finally wasnt enough storage think could use extra gb future use sd card legit well definitely recommend,20
1017,3,good quality product price buy go pro havent issue yet,10
1018,4,couldnt find cheaper anywhere else price simply cant get anything better write fast plenty storage use blackberry q10very recommend,19
1019,4,32 gig san disk memory card go tablet give christmas giftno problems fast performancei load music video store laptopi still 12 gigs leftvery happy memory unit,26
