,Rating,Review,Length
3031,0,buy instal droid razrm never remove die little 6 months store apps anything picture video phone,16
3032,4,buy gopro couldnt record anything didnt microsdhc class 10 memory cardnow problem solvedtherefore 5 star,15
3033,4,buy gopro black edition ive use product little month dont lot experience different micro sds product right use microsd exactly suppose far stay way rarely even think work,28
3034,4,samsung galaxy note 3 love house music picture without issue seem like rw speed bite slow really cant complain,19
3035,4,solid card use gopro hold data read write speed impressive,10
3036,4,work movies songs save play tablet love,7
3037,0,look review see card seem failure rate incompatibility devices buy card november 2012 work great card start fail galaxy note 2 begin january reformatting try card devices still work please understand user error appear something wrong card try card 3 different phone 1 stock jelly bean 1 ice cream sandwich 1 cyanogenmod custom firmware 3 devices problems say blank sd card unsupported filesystem even format card windows use android seem fix issue happy find good price large microsd card sadly look like get pay appear people luck might worth gamble 20 feel lucky buy card would wise double check backup process make sure lose picture videos problem glad use dropbox phone lose picture videos,114
3038,4,game 12 gb days card great store high graphic game note 2 extsd2intsd mod go sd card think internal storage exactly need,22
3039,4,dont know buy im glad 32gb would good buy consider huge itunes collection 28gb would increase pass 32gb buy 64 problem since playstation plus account buy sony music unlimited reduce price 12 buck leave pretty much entire music catalog palm hard without waste single gb memory still love product work would definitely recommend,53
3040,3,bad product get blackberry z10 format phone software afterwards work like charm couple months problems class 10 64 gig complaints reason didnt give 5 star isnt particularly outstanding way pretty simple product job problems good go,36
3041,4,cant believe 32gb fit small space blow mind first computer half gb hard drive size book sorcery,17
3042,4,product serve well last two months lot storage reasonably price,10
3043,4,buy sandisk ultra 64 gb new samsung galaxy s4 faster type memory like think read write fast feel like phone know highend dslr youll notice difference please,27
3044,4,card extremely fast order leverage full capability card reader device must support uhsi however also fast class 10 devices,19
3045,4,come easytoopen package instal right away new samsung galaxy note 101 2014 edition work great,15
3046,3,fit appear worki yet issue cardhowever use weeksso comment base experience thus farif position change delete postso read problems occur thus far,22
3047,4,super low price expand storage bn hd nook buy 16gb version save money spend buck microsd card double storage use adapter easily pop laptop pc easily transfer file go better yet buy two,33
3048,4,work fine record hd video copy movies fast,8
3049,1,sandisk quality fail move another brand ive three memory card fail short order,13
3050,4,order card friend ship prime week friend still didnt card ok call amazon new card mail day overnighted great service amazons partits micro sd card say dont know use one dumb walk traffic,33
3051,4,get shoot hd work really well far handle hd record playback great,12
3052,4,know buy sandisk confident fast reliable product work great netbook minutes,11
3053,4,card able transfer picture movies music toast hard drive cell phone fast although dont necessarily believe need fastest card cell phone afford would get snappy cell phone able process write sd card extremely fast make happy,36
3054,4,buy pair amazons cyber monday sale 3898 ea one work great galaxy s3 synched around 40 songsminute use mediamonkey mtp mode go use sd adapter backup dslr long 1080p video test issue make primary card send old 32gb sdhc bottom camera bag,42
3055,4,dont need extra card,4
3056,4,could let thing bang around pocket full key coin accidentally course still come work great sandisk make great sd sdhc microsdhc products one affordable easy use storage also come sd card adapterive use move picture file onto chromebook ease,39
3057,4,price spot 2499 less 1gb storagenice solid design easy mount recognize card immediately samsung galaxy ii tablet never errors readwrite speed amazingly fast,23
3058,4,love card well worth good size tooif anyone question please dont afraid ask meid happy answer,16
3059,4,use many technological devices work like charmi actually get class 10 speed 998 time literallythe 2 probably relate readwrite speedand let remind say earliermany platforms tabletssamsung galaxy s3s4cameraspcectworks like charm good job sandiskyou let,34
3060,4,buy replacement another 64gb micro sd card two years die days ago issue yet load fine read write speed seem fine able transfer 27gbs data minutes use note 3 issue,30
3061,4,expectected bougth use gopro work perfectly recommend,7
3062,4,card special offer keep couple themso fast affordable say sandisk,10
3063,4,nice addition note 8 inch wifi excellent know brand use camera nikon d7000 im happy unit memory give flexibility classten quick,21
3064,4,ive plug play galaxy s3it cheap extra 64 gb want iphone youll pay us 100 per 16 gb 2 year contract carrieri remember last time download picture pci take hundreds 8mp picture bunch full hd videos around 30000 mp3 still spacei love,42
3065,4,buy one add standard one already purchase size speed price worth,11
3066,4,want one badly fact order two aside someone steal first package send glad could go amazon see super cheap price deliver 2 days quicker could go get one live nyc tons stuff quickly load onto put asus transformer t700 instead wait super slow usb cable transfer directly tablet one put galaxy s4 sheer overkill dont worry run space,58
3067,4,file system ship might appropriate phone stick format phone good go,11
3068,4,work great excellent speed format fat32 new samsung galaxy note 2 memory let load larger game apps gl sd media file main internal memory fast,25
3069,4,package arrive estimate time well do instal galexy optimus pro recognize immediately work well expand room pics apps,18
3070,4,lot storage space phone let lot music roms cant live without card,12
3071,4,lot memories work fine gopro camera think little expensive see real price store totally change mind,16
3072,4,ive try memory card really bad result finally decide go sandisk may little bite expensive others ultimately reliable,18
3073,0,buy month use samsung galaxy s2 fail could longer see contact support say send get replace expensive buy new one,20
3074,4,sandisk great product around buy sons samsung galaxy tab fit perfectly weve throw three movies already im plan add couple would definitely guy,23
3075,4,work great samsung galaxy s4 problems good speed price right couldnt go wrong also test gopro also work well,19
3076,2,buy two different time retail package android model number match packagingthe first one 32gb test dd builtin sd card reader mbp gfr204sd usb device couldnt get 8 mbs average write speed would bounce 6 10 class speed suppose minimum maximum rw hdd 20 wasnt bottleneck neither uhs compliant least able get class 10 rat read 30 mbs pretty accuratethe second one 64gb test watch activity monitor see ballpark bounce 8 10 copy hard drive ram disk sound like probably class 10 read speed ram disk 24 mbs,87
3077,4,use samsung galaxy s3 spacious hold large chunk music library im happy havent stability problems seem reasonably fast purpose complaints,20
3078,4,buy samsung tab 3 pc camera cell phone great little drive store music file price excellent well fast ship pack well great deal way around,25
3079,4,recently switch iphone s4 im try get use lack board memory card work well memory use picture im still work way around actual phone memory serve well,27
3080,4,buy two one wife one self great price fill bill great expand memory samsung giii andoid,16
3081,4,buy 2 1 use stealthcamwith include adapter 1 use tabletan acer a500 far card work flawlessly applications choose use microsd card make possible copy picture trail cameras use tablet woods remove need dedicate viewer tote laptop extra card,38
3082,4,happy get steal price definitely lot space need gopro dslr camera much better less,14
3083,4,get one wifes s3 work perfect frustration free package nice open package get right product didnt anything specialjust put s3 work immediately issue,23
3084,0,get samsung 3 4 months longer accessible first message get phone unformatted sd card instal next wouldnt even recognize card insert different card phone able recognize play music phone also try desktop read card go either,36
3085,2,know gs3s issue read card size eventually remove card purchase transcend 8gb class 10 card check phone problem get open packet pop right recognize able start use take shots video immediately save card without hangup old class 2 card use couple days notice would take shoot phone would give error could save sd card would reboot fix scroll gallery sd card would freeze app would crash move could format card thing keep happeningsince instal new transcend 8gb card ive issue maybe phone think enough complaints gs3 owners little skeptical card phone,91
3086,4,carry ton digital content phone never want run space fast micro sd card give 75 gb usable space samsung galaxy note ii take 20 picture 5 second listen musicfast efficient tons storage ask morebillh,34
3087,4,purchase base recommendation reviewer dash camera also purchase issue work,10
3088,4,ive couple crap far one first heavy duty one fast responsive hope last better others ive,16
3089,1,always use sandisk products disappointment totally fail galaxy s3 8 months order another brand sandisk,15
3090,4,say great work fast never unmounts randomly use bump music samsung gs3 note 3 tab 3 8 tab 3 101 always work would suggest anyone price another nice thing color make easier find drop,34
3091,4,say far remember everything it8217s tell sign alzheimer8217s date far see stare space talk child complain different music first start store music say much data change back day82308230 nope still young pretty fast arthritis bits bytes,36
3092,3,buy two one one husband work great feel good lot space smart phone save picture movies take etc,18
3093,4,pay less 60 ship door 2mth problems format fat32 fast internal memory note 2,14
3094,4,high quality easy use product ready insert go problems capacity package,11
3095,4,didnt expect problems didnt either great sandisk quality decent price speed rat happy,13
3096,4,satisfy speed space little guynote need format cellphone capable use micro sd xc card reader compatible sd xc see 32gb get couple errors format first computer sd hc reader xc work fine,32
3097,4,buy surface rt tablet work great love come adapter,9
3098,4,recently buy microsoft surface rt tablet use 32gb version memory card work great didnt problems hear surface rt could expand 64gb immediately look great deal online behold amazon offer card 50 prime eligible woohoo 34nobrainer34 quickly order inexpensive upgrade like predecessor come memory card sd card adapter small plastic case instal card super easy surface line slot push till click thats format require card run quite fast normally buy sandisk extreme memory card faster particular card problem run video file play musicanyway get card surface rt tablet dont format well card already format risk mess card pop enjoy greater space surfacenote far know cannot install surface apps onto memory card media file document still card great upgrade highly recommend,119
3099,4,get memory card gift use new contourroam2 camera accord lot users shouldntwouldnt work camera even technical team contour tell optimistic ultra memories sandisk work camera still,26
3100,4,great product affordable price theres mess sandisk quality 64 gigs youll plenty room store anything everything want,17
3101,4,format card ntfsloaded bunch kid favorite movie tv show transfer seem pretty speedy even play hd content,17
3102,4,card meet requirements want 32 gb card adapter want faster card c10 work box problem buy 2 time one mine one wifes smartphonesamsung galaxy centura satisfy,26
3103,4,im light user dont store lot media phone dont play lot game watch lot videos keep media music photos docs etc backups dont notice much lag lag notice maybe every couple months attribute phone card shutdown restart usually solve great way space ill ever use youre heavy user may need much storage space 20 get know youll never run space,60
3104,0,work purchase 4 start dyingone one none longer work,9
3105,4,perfect describe,2
3106,4,sandisk best moist reliable memory card perfect fit new galaxy note 3 smartphone,13
3107,4,good storage,2
3108,4,place sandisk 64gb micro sdxc card galaxy s5 phone phone 34sees34 card tell card 64gb space available far good ill update review card stop work,25
3109,4,search inexpensive 64 gb micosdxc card new samsung galaxy note 101 2014 edition 32gb tablet one catch eye regard positive comment price note christmas gift use media entertainment business travel replacement age toshiba notebook problems install card recognize upon bootup installation dont require great transfer speed task quick test use es file explorer copy 400 mb media file tablet os card expansion card yield 10 mbs write 40 mbs read speed sufficient task bonus add card shop cart 4699 follow day price drop 3799 incentive need push 34place order34 button cant speak much reliability since ive card instal less two weeks far stable,103
3110,3,excellent product high capacity well make hold many pics movies musica gift camera buff ive always want hicapacity item sandisk,20
3111,0,get card months ago use note 3 fail matter try attempt format drive edit file whether use computer phone fail card data essentially readonly save grace since could least save dataprevious issue corrupt photos randomly increase regularity grow closer complete failure go avoid sandisk possible,45
3112,4,buy lumia 1520 windows phone supplement onboard storage capacity fit fine work great fast access immediately recognize device much ask microsd card,22
3113,4,personally get mine expand surface storage work brilliantly hold media movies tv book picture plenty room spare,17
3114,4,order use new samsung galaxy sii phone ive use sandisk past always great luck products would definitely recommend product,19
3115,0,insert galaxy note power phone go storage press mount sd card say didnt understand filesystem ask want format saw 59 gigs free spaceworks great get 43 buck amazonconits extremely slow write try write 3gb file pc card take 26 minutes 2mb sec write internal sd card phone write 10mb sec dont understand slow accept slower internal sd however didnt know would dog slow 32gb samsung micro sd much faster,69
3116,4,good fast inexpensive microsd noticeably faster task class 4s hang around useful dont access cloud storage,16
3117,4,much say except work great rw speed never seem slow photo movie take 32 gb double capacity tablet wont reach capacity long time,23
3118,4,32gb microsdhc card replace 16gb card order easy price good product arrive well package fully functional,16
3119,4,thing else need saidthis put samsung s3 card work work far wo hickups price good amazon,16
3120,4,work expect great price install gopro hero3 problems record play back video,12
3121,4,get galaxy s4 work great complaints highly recommend all32gb perfect take lot pics videos,14
3122,3,years ive find sandisk memory durable reliable 16 gb class 10 card appear exception far perform well especially appreciate fast write speed money good deal,25
3123,4,im still stick 10 years ago microsd card fairly new still neat amaze much put something literally size fingernail purchase class 10 64gig exclusively use mygopro hero3 black editionso card keep camera record hd 60fps amaze many people arent aware class data card affect performance capture video even still try capture video shut automatically may memory isnt fast enough keep youll problems keep card problems store sandisk memory often get label best cheap memory im unsure expensive poor memory would anyone buy anything else expensive card get good ive also purchase two 32gig card samsung s4s,96
3124,4,ive use card 2 months work perfectly instal samsung galaxy s3 immediately recognize need format special handle,17
3125,4,item arrive perfect shape even include sd adapter need card work fine far complaints,14
3126,0,day die lose data expect sandisk microsd card case,9
3127,4,like small hold lot memory fit adapter yet find anything bad kind memory kind electronic equip require use mini,19
3128,4,buy use samsung galaxy s4 work great transfer speed excellent completely plugandplay compatible device,14
3129,4,two use gopro hero3 work great get could 64gb far prefer 32gb card full right battery reach end life swap card battery time save openingclosing case swap part time card plenty fast never hiccup prove quite reliable 3rd card use multiple mobile phone htc bb since 2010 never problem,49
3130,4,use 1034 android tablet issue mount easily seem job,9
3131,3,work expect use one samsung galaxy s4 another asus transformer problems far,12
3132,4,work describe buy 2 one one wifes tablet love amazon ease purchase super fast ship item come retail package hard remove store prevent theft use scissor youll get eventually show 2971 gigs instal typical sd card download sandisc memory zone app see fast card need purchase one tell exactly need may save buck,53
3133,4,hard believe 64gb size pinky finger nail complaints use lg phone plenty fast enough anything,15
3134,4,buy mp3 player work great move music around like fact come adapter card readers cheaper ones dont,17
3135,4,use high def camcorder record 1080p video ive problems clip card seem well able quickly handle amount data get pump ive quality control issue data loss either would definitely buy,30
3136,4,prefer sandisk manufacturers come trust quality workmanship products,8
3137,3,use card sandisk sansa clip work 4000 songs count say,10
3138,4,immediately recognize windows 81 laptop reformat exfat fat32 order recognize samsung note 2 734 android tabletit take long time transfer 25 gb video file laptop ssd hard drive sdxc cardi imagine would happen quickly work smoothlyoverall want great deal price,40
3139,4,compact size helpful transfer speed quite good highly recommend people large storage requirements,13
3140,4,come genuine retail package work great camera work great computer like color make easier find dark camera bag tiny black ones get lose fabric,24
3141,4,fast work describe plenty space leave free fast transfer speed use compatible card reader would recommendthis product feature amazon frustrationfree package recyclable come without excess outer package materials hard plastic clamshell case plastic bind wire tie package design open without use box cutter knife protect product well traditional packagingas write sandisk ultra microsdhc card ia actually price lower class10 card pny polaroid make sandisk best value especially need honest class10 performance across platforms,73
3142,4,sandisk always reliable brand products typically outlast devices pair card decently fast write speed able 10mb read 246 range plenty fast hd video,23
3143,4,love micro sd card awesome amount space plain ole reliable dont find many products like nowadays,16
3144,1,far good suppose doesnt seem faster slower micro sd card buy cheap imitation ebay regret crash really doesnt pay cheap memory reliability get product1017 update big problem sd card windows phone user properly record hd video video record sd card consistently choppy pop another sd card record fine record phone record fine ive try format every way isnt work well go another brand windows phone users,66
3145,4,sandisk ultra 64 gb microsdxc class 10 uhs1 memory card 30mbs adapter sdsdqua064gu46a fit nicely htc vivid system recognize right bat simple easy format disk encrypt snap well many review internet product possibly work htc vividi believer research read review work like champ price reasonable amazon,46
3146,4,price alone make product well worth class 10 pay lot get quality disk rare choose order amazon,17
3147,4,plug play simplicity pop work didnt even need format believe sandisk say format exfat im good wifes phone show approximately 119gb use hold whole heap photos videos,27
3148,4,get samsung galaxy talet 2 101 ideal tab problems get day get exactly want,14
3149,4,say great chip fast reliable 6 months far single problem lot handle,12
3150,4,buy extend memory galaxy iii great price easy install phone recognize instantly suppose,13
3151,4,price memory card work well issue surface,7
3152,4,work get black fri deal would cheap get 1632gb nice endless roomi already watch movie surf net phone pop player awesome phone come standard sd card adapterfunny storyi plug go format phone want password format card dude could find anything online people ask question well realize lock screen phone also put lock format card great idea samsung thank duh moment,60
3153,4,use smartphone samsung push go problem good price enjoy lot music,11
3154,3,sandisk chip pretty good relatively expensive timesyoud think online price would affordable tell seller sell fake product ot notthe one receive genuine sandisk products return exchange another genuine ive problem exchange company knock woodthe 32gb version work well android tablets 64gb versions beware read online forums 64gb version work relatively well though android phone weirdwhy would work smartphone tabletprices drop may come price local retail store shop around,68
3155,4,theres way give bad rat exactly suppose andthats espand memory hve use scandisk memory card long time never disappoint apps tablet automatically download memory card issue complaints,27
3156,4,micro sd card work great galaxy s4 double storage space quick respond would definitely recommend anyone buy new smart phone,20
3157,0,card read 27 gb 64 gb format various format various tool operate systems order replacement conclude dud good luck buy product rest assure amazon good return policy,27
3158,3,notice amazon ultra version couple buck standard black version one come sd adapter case ever need havent bother speed test since im use tablet dont feel like remove tablet test seem fast enough experience far definitely faster regular black sandisk cardsfrom experience sandisk products readwrite speed much faster claim conservative estimate worth mess standard line get ultra extreme pro much,60
3159,4,put nokia lumia 521 far work really well put entire itunes library phone write card believe hour didnt keep trackmy regret probably purchase 64gb card,25
3160,4,item purchase smart phone sale price excellent item arrive intact time work great,13
3161,4,buy supplemental storage asus transformer tf201 tablet card need special format work work upon first installation stay plug tablet nonstop ive use 3 months additional storage music videos without problems dont speed benchmarks havent notice slowness copy delete large amount data device suppose therefore give 5 star,47
3162,4,sandisk ultra 64 gb microsdxc class 10 micro sd card storage enormous among data class 10 reliability speed great buy,20
3163,4,buy 2 2 sons save game songs whatever else dss space use quite awhile price superbly,16
3164,3,question sandisk continue innovation really keep storage computer go need electronic file music game securely store protect computer phone mp3 players tablets micro sd card become increase need laptops computer need sandisk make several products time continue get better innovation ultra micro sdhc memory card handle well work nicely store media file one convient package like safely mp3 file card play sandisk mp3 player nicely definitely good buy anyone really want bite extra space definitely recommend micro sd memory card extra storage spaceprice bconvience boverall b 12,87
3165,2,first two order item fail fail around six months use however sandisk honor warranty completely replace items still use pretty happy,21
3166,4,buy sandisk item like others purchase work perfectly first time love,11
3167,4,use gopro hero 3 silver work great problems data transfer quick,11
3168,4,store lot hd picture videos longer issue sd card errors lose data highly recommend anyone buy class 10 sd card devices 5 months issue,24
3169,4,utilize gopro hero3 blackno issue film transfer computer good transfer rate glad get 64gb film photos do,17
3170,0,either wrong chip false read device data display consistently 34insert 34,11
3171,4,lowest price 64 gb card could find work great hero go pro camera,13
3172,3,say memory price right fast galaxy note 101 doesnt complain neither,11
3173,3,find really good price buy 2 one wife galaxy note 2 phone work fine issue right start however luckily right start almost nothing reformatted galaxy note 2 work fine ever since recommend format computer format phone work good,38
3174,4,seem work fine samsung galaxy iii new android 411 os big card phone handle62 anyone know,16
3175,4,use hisense sero pro fast xfer rate measure 29gb format happy,11
3176,4,back purchase samsung galaxy s4 decide factor iphone capability sd card storage chance come grab 32gb card 20 dollars jump perform flawlessly come standard size sd card fit micro access computerfolks purchase android phone sd card capabilities dont go 32gb phone pay hundred dollars grab micro sd card less thank morning,51
3177,4,buy sandisk card one good like expect great read write speed issue whatsoever also 64gb one goodalso come adapter use biggerolder size sd card slotsbuy confidence,26
3178,4,unbelievable room tiny package far able store retrieve hidef video problems,11
