,Rating,Review,Length
0,3,issue,1
1,4,purchase device work advertise never much phone memory since download lot stuff brainer,13
2,3,work expect spring higher capacity think make bite cheesier earlier versions paint look clean,14
3,4,think work greathad diff bran 64gb card go south 3 monthsthis one hold pretty well since s3 note3 update 32114ive months zero issue since transfer s3 note3 note2 card reliable solidcheers,31
4,4,buy retail package arrive legit orange envelope english version asian like picture show arrive quickly buy 32 16 retail package htc one sv lg optimus card work order probably best price youll get nice sd card,36
5,4,mini storage doesnt anything else suppose purchase add additional storage microsoft surface pro tablet come 64 128 gb suppose sandisk long stand reputation speak,24
6,4,phone never skip beat file transfer speedy corruption issue memory fade issue would expect sandisk brand great card entrust precious file slightly cheaper piece crap lose everything forgive spend extra couple buck trust product go good qa,37
7,4,hard believe affordable digital become 32 gb device one quarter sie postage stamp would science fiction less generation agoi pick portable music didnt want schlep risk phone ipod work great sd card readersselect confidence,34
8,4,work htc rezound run short space 64gb sandisk order come fast issue,12
9,4,galaxy s4 super fast card totally happy happy still type fill require word though,14
10,4,like sd card take music video download personal videos filesdocs multimedia image fast transfer rate class 10 speed take game large file easily still enough space apps it34s great video cameras camcorders supply adapter fit easily smartphones tablets sd card slot recommend 32gb sd card everyone,46
11,2,work file write bite slower expect usb3 readeralso read write faster card inside standardsize sd adapter 15 mbs vs 10 write 45 mbs vs 22 mbs read card reader cant figure,31
12,4,name speak go sandisk go,5
13,4,solid sdhc card fast read write fast record video pics great capacity reasonably price issue itoverall highly recommend,18
14,4,hear card write speed insufficient however use extensively havent single problem,11
15,4,buy use go pro hero 3 black edition require class 10 microsdxc card far ive issue fast readwrite come adapter small package thats need come nice hard plastic case keep dry together need,33
16,4,get 2 gb one fill keep get insufficient disk space phone kid take phone selfies mostly daughter get bigger card 2gb one carry old phoneneedless say sweet plenty space dont delete picture anymore well leastmy daughter love selfies,38
17,4,class 10 speed rat seamless full hd videothe sandisk ultra uhsi card feature class 10 uhs speed class 1 u1 rat highest video performance available record uninterrupted full hd videoflawless app performancethis card retrieve store data almost instantly thank 30mbs read capability fast bus interface sandisk ultra microsdhc microsdxc uhsi card offer faster app load smoother fluid app performancestorage capacities 64gbthis card plenty room accommodate full hd videos mp3s apps memoryintensive mobile file available size 64gb store apps music video wantandroid app easy file managementthe include sandisk memory zone app let easily view access backup digital file phone memory additional memory card cloud service one convenient place use app easily move file card number cloud storage servicesdurable designsandisk ultra uhsi memory card capture memories 13 185 degrees fahrenheit shockproof waterproof xrayproof design mobile device may survive sandisk memory card,139
18,4,read write speed better samsung sd card previously would hesitate buy another one great micro sd card sandisk also clip plus mp3 player work well think im become fan sandisk products,31
19,4,work nl1520 video stutter like 64gb blah blah blah blah fill rest,12
20,4,work expect high transfer speed nice extra microsd adapters lie around since always seem misplace mainly buy use nikon dslr since put card directly cm modded nook hd tablet field view image larger screen,34
21,4,work great samsung galaxy s3 format straight away full size cant really tell speed difference one slower card replace guess io phone cant take advantage,25
22,4,sandisk never disappoint always sandisk products worth every penny nice product quality work great recommend product everyone,17
23,4,good price work flawless samsung s4 normal sandisk quality go brand brand,12
24,4,san disk hard beat pay brand get quality product would purchase,11
25,4,instal blackberry q10 sqn1001 format work fine plenty storage space picture videos son park,14
26,4,receive card class 10 64gb correct serialsdsdqua064ga11a receive unopened sandisk package go use htc rezound hope work read work reformatting disk update review issue use rat remain unchanged,28
27,4,stick s2 format settings work great already fill music pics videos get card format right youll problems phone wont right get samsung haha,23
28,4,purchase two one samsung tablet one samsung galaxy note great hardware truly speedy responsive meet need,16
29,4,advertise specs match long device use handle ie usb 30 crapple bs deliver advertise speed ps speed read write know right,21
30,4,item great cant believe small imagine 64gb size back 70s whole build full computers couldnt pack much space great item,20
31,4,ive try get hold 32gb micro sd phone tablet pretty fast compare 16gb card ive use really saw performance boost phone many apps picture music document phone boot fully stable 2 mins appose 56 mins computer also write card much faster 16gb ones use phone tablet device support recommend purchase also pay like half price use amazon oppose retail store whos price least double ive see card go 72 area,70
32,0,buy 2 sandisk 32 gb microsd use galaxy note galaxy s4first one phone start say remove recognize diedi think luck plug 2nd one stay 2 months die suddenly lose everythingnever buy sandisk ever,33
33,3,memory card excellent condition work describe dependable easy use excellent choice enthusiast require storage,14
34,4,ive get couple vary size ive problems complaints speed always end buy price low get,15
35,4,8 gigs memory note 2 run room much memory space available dont know,13
36,4,buy surface pro ive months ive problems fast stable,9
37,4,would recommend card everyonedata transfer speed excellent card galaxy s2 didnt need format card anything 100 satisfy,17
38,0,bougth micro sd card trubles get kingston tell sandisk quality best i9300 phone read 64gb fast dta transfer speed pc amaze look additional storage phone music picture type file youprosvery good quality materials constructionamazing speedupdate one year memory damage delete put new file format memory try format phone pc camera nothing like 64gb cd data memory available read move delete buy memory use backup data android device readable memory write data hope sandisk make better products future total disagree buy samsung memory card expect better quality,86
39,4,use contout gps camera dont waste time buy brand waste buy best start,13
40,4,fantastic little drive gigabytes say work ways discern use hold flac record play excellent fiio x5 digital audio player real thing one fake evidently,24
41,4,happy micro sd could tell difference response time bb curve well asus tablet want something transfer file photos videos music faster micro sd card say faster card price trick devices professional photographer might want go ultra 3 micro sd everyday user work wonder device,44
42,4,ive purchase several little baby years always buy sandisk ive never one fail price great amount storage get,18
43,0,order galaxy s3 last months break accessible several different pcssays limit lifetime warranty bs one month eco zone lose picture crappy return policyin future buy kingston sandiskupdate amazon customer service make good refund purchase price still buy sandisk memory card however,41
44,3,like 8mbs note 101 thats use sandisks app bite faster note ii still disappointment devices quad core processors sure card device benefit doubt four star,25
45,4,much say plug play good quality fit lot video good good good,12
46,4,new camcorder require fast sd micro sandisk products always provide first class service extra cost well worth,17
47,4,tiny marvel claim possible problem small may lose happen drop handle 16 gb capacity wont handle often,17
48,4,job price right come quickly im happy purchase would recommend would,11
49,1,use months phone decide quit mount lose picture pet die shortly get replacement card send old one give chance recover content new ones work fine fail 3 months inexcusable,29
50,4,memory card either work doesnt always go one star five star review middle groundthe adapter nice bonus though dont think anything use,22
51,4,purchase card use contourroam2 work great put card camera format good go allow easily record hours 720p60fps video without run space slow,22
52,4,upgrade 32gb 64gb card galaxy note phone look like work fine full capacity good product,15
53,3,everything great except adapter tight use tool take back adapter cause chip fault guess also buy 16gb version adapter one fine,21
54,4,like first one purchase much buy second one fast read write speed good price plus sandisk best software device compatibility forget thumb drive flexible durable option use direct tablet smart phone andor buy decent usb card reader load voila instant superspeedy upgradeable thumb drive work great tablet newer card reader still kick butt every thumb drive know even use old plastic usb 20 card reader hold together scotch tape lol purchase several microsd card since first come 2gb 32gb still work fine cannot say thumb drive purchase time periodone point beware counterfeit samsung number one brand unfortunately get counterfeit lot check review buy reliable seller suggest buy direct amazon memory mogul purchase issue,113
55,4,really cant say anything bad say super fast great storage size lot movies,13
56,3,use phone plenty fast work like unexpectedly come mini full sd card size adapters nice 34foolproof34 package whatever laughable package decent shouldnt brag impossible mess mess,26
57,4,standard micro sd card would recommend anyone purchase dad use expand memory tablet ship fast slight bite cheaper store believe,20
58,4,order new samsung galaxy note ii work awesome instal problems load music didnt even scratch surface capacity card shouldnt ever worry run outta room card highly recommend smartphone user,29
59,4,great deal much faster file movementdefinitely worth purchase sandisk prove good products,12
60,4,youll pay 10 anywhere else initially leery buy another sd card amazon 4 years ago card fake say 32 gigs plug computer could load 11 onto would say 34full34 apparently theres way fool computer think theres space fakecounterfeit card donot one real deal genuine sandisk contain many gb say im please customer,52
61,4,use samsung galaxy s4 almost year problems really expand memory capabilities easy enough install,14
62,4,32gb storage new asus tablet whats love cant imagine pay model upgrade storage especially since usually like 100 thing cheap work great,22
63,4,excellent quality excellent speed complaints easy use reliable red stripe front make easy find crowd desk,16
64,2,card advertise uhs1 actually uhs50this mean go sdr104 speedsthroughputnot necessary bad false advertise,13
65,4,purchase hp tablet memory music download picture video enough room store memory leave,13
66,4,anything wrong sandisk product items read sooooo quickly quite happy,10
67,4,lot people want big memory fine need look speed class one class 10 great take picture video freeze move mbs fast enough lesser speed card freeze say wait camera miss moment also sandisk name trust come memory card,38
68,4,fast transfer rat download 2gb videos form card laptop card reader minute,12
69,4,something say sandisk plug work ive never one doa memory issue throughout years camera storage products instal galaxy siii recognize right away able dump music onto speed seem great well complaints,31
70,4,praise extra memory fill mp3 player every song heart desire sound quality perfect ease use superb great,17
71,4,though state 16gig 148gig available know happen expect keep mind want storage might want order 32gig card exactly expect need complaints,21
72,4,job advertisedif need extra memory phonetablet whatever device bext buypricequality,10
73,4,need cell phone work perfectly sandisk never disappointment 30 plus years ive itcomputer work,14
74,4,price right memory card also read write fast noticeable difference cheaper card put phone plan buy another one tablet,19
75,4,work great sprint htc evo 4g lte format w fat32 course maximum file size 4gb mean full length hidef movies however isnt problem buy card put music library phonelike class 10 microsdhc card 10mbs closer class 10 card ive ever try 34mbs kingston 32gb 7mbs card 89mbscant wait till 128gb 256gb card become available affordable,55
76,4,update 62414my 128 gb card stop allow write via cardreaders windows pceither inside several fullsize sd card adapters writeprotect tab either position plug directly microsd slot reader microsd card writeprotect tab quite surprise worry fail find workable solution search online finally put chromebook create new folder stick back windows pc longer give writeprotect error anyone similar problem id recommend something similar put pc laptop camera etc available try write therethis portion review necessarily write update original review 64 gb version card since amazon disallow multiple review consider item portion concern 128 gb version cardi dont need fast card speed card important besides test pc exactly highend therefore didnt count speed result get use usb 20 card adapter think might relevant readers card reach class10 andor uhsi requirements come 23 claim read speed 30 mbs fast file transfer run second pc use different usb 20 card reader none speed even hit 5 mbs seem highly systemdependenti get card week far work select sdxccompatible devices exfatcompatible operate systems sdxccompatible devices panasonic hdctm40 allow card larger 64 gb whatever reason state manual ive confirm card recognize brokencorruptunusable device whereas 64 gb exfat card work fine 128 gb work fine original exfat format toshiba excite 77 android tablet predictably nonsdxccompatible galaxy note 2 though possibly would reformatted fat32 since 64 gb card fat32 work fine thereill update review reflect problems issue etc notice come days weekscrystaldiskmark 303 c 20072013 hiyohiyocrystal dew world url remove per amazon rule mbs 1000000 bytes sata300 300000000 bytessequential read 18694 mbssequential write 11921 mbsrandom read 512kb 18502 mbsrandom write 512kb 0680 mbsrandom read 4kb qd1 3339 mbs 8151 iopsrandom write 4kb qd1 1581 mbs 3861 iopsrandom read 4kb qd32 3151 mbs 7694 iopsrandom write 4kb qd32 1564 mbs 3818 iopstest 1000 mb g 00 001191 gb x5date 20140424 165349os windows xp professional sp3 51 build 2600 x86the follow original review 64 gb version card publish april 24 2013this highquality card ive use variety devices multiple readers different pcs hd camcorder use micro fullsized sd adapter ive never problem even work full capacity microsdhconly devices reformatted fat32 sandisk clip flac player supposedly even psps via proper adapter though havent yet test psp keep anticipate someone come card equal better capacity speed comparable price havent see one yet cheaper id several nowmake sure device handle micro fullsized sdxc card one rare gems state support high sdhc test work sdxc card one theyve manually reformatted fat32,404
77,4,work great phone wife love get second mom store lot picture videos,12
78,4,load card home movies samsung galaxy tab 2 copy process computer card fast skip movie quality plenty room leave go wish buy another collections,24
79,4,buy s3 load 4 season futurama 5 full length hd movies several documentaries dozen 30 minute comedy show plenty room leave picture etconly slight nitpick boot recovery mode s3 recognize card want update phone latest version android would see resort 2gb microsd lay around wasnt sd card issue think would throw,51
80,4,purchase wife buy samsung galaxy s4 store music picture videos s4 camera capable capture 16megapixels photos 16gb microsd suffice matter fact ive already exhaust remain space card 64gb allow take photos son,32
81,4,great storage fail yet year usage,6
82,4,since wife use cause problems must function normally look good far,11
83,4,class 10 speed way fly 2971gb usable space think good,10
84,4,subject say suppose great price sale buy,7
85,4,lot question memory card fit samsung galaxy tab 3 101 tablet fit work problem thing instal instead show 64gb available show 59gbtried format card resultshave idea limit set galaxy tab 3 tablet 34normal34 buy 64gb get less thatas surely problem come sandisk memory card rat 5star excellent price work great quick delivery,52
86,4,come kind flash storage sandisk always go brand sell quality items stand theres problem usual complaints work descry havent issue read write speed right specs say,26
87,4,high speed high capacity storage great durability use phone digital camera work good,13
88,4,memory help keep want keep cell phoneit good brand right price,11
89,3,buy sd card android phone think class 10 faster reliable others turn difference class doesnt really matter least android phone didnt really worth price difference,25
90,4,sandisk 32gb micro sd class 10 reliable sd card amaze transfer speed noticeable lag transfer even largest raw image hadnt problem,21
91,3,good card work describe havent issue go pass metal detectors lose file miss file,14
92,4,buy store music phone work flawlessly three months far problemsin card reader average 68 megabytes read write,17
93,4,im amaze order amazon tuesday morning arrive wednesdays mail impressive service amazonas already report card format 59 gb perform perfectly samsung galaxy iii also new use two card readers fast pc transfer everything old 16gb card new 64 gb card less time take walk kitchen get cup coffee think class 10 rat correct cardonce experience card phone ill benchmark card ill also benchmark operations internally back android phone card ill update review accurate numerical data mean time first look person say 3 problems anything faster class 6 may correct full backup phone card significantly faster backup old 16gb class 6 card benchmarks yet ill include hereright im happy card im really impress card unbelievably quick service amazon im atlanta shipments like one often take full 3 days arrive,128
94,4,excellent one best cant go wrong card class 10 necessary show noticeable significant improvements class 4,16
95,4,buy 64gb microsd card best buy need one microsoft surface pro provide space need people need lot space videos quick book picture edit game etc card one dont need much space consider buy one cheaper little less memorynote aware microsdxc format card new computers support format many older computers include tablets smartphones buy make sure computer tablet smartphone compatible work period others claim card doesnt work matter try chance machine cannot support microsdxc format,74
96,3,get couldnt pass deal 1799 incredibly fast htc sensation 4g picture take save instantaneously days happy ship fast package easy open always great book issue format computer first phone able recognize,31
97,4,get lot storage small price micro sd adapter class 10 fast happy purchase hope review helpful,16
98,4,ultra micro sdhc fine get work neither package sansa clip player inform user player need totally microcard insert unit read card otherwise love storage even 16 gb let alone 32 tremendous,31
99,4,upgrade price drop originally 16gig sandisk card mytouch 4g find toward mytouch 4gs end life space run low get galaxy s3 buy card work flawlessly highly recommend errors ever super fast transfer rate,33
100,4,item price right fit right cell phone without issue suppose dont know else could say class 10 suppose plenty fast cell phone use sure speed camera use degree work well ship fast,32
101,3,get memory card samsung galaxy s3 run room sandisk 32gb class 4 micro sd card also want faster durable card hop put lot media addition nandroid backups custom roms later find since card format exfat would work make nandroid backups flash custom roms custom recovery custom roms dont work exfat choice format card fat 32 mean couldnt put file larger 4gb besides card great reasonable price 50 one doesnt root phone put custom roms nandroid backups put file larger 4gb affect memory card fast provide storage put mobile device time card also water proof shock proof come lifetime warranty ive never issue sandisk memory card usb flash drive last really long time,112
102,4,use include adaptor macbook pro transfer file impress speed card,10
103,4,get store movies music samsung note iiinot much say memory card except work expect,14
104,4,purchase version expand memory 16gb android tablet nothing fancy job problems play back flawlessly file transferredthere many different microsd card see sale might want consider instead cheaper noname brand,29
105,4,ive order sd card one best overall ship excellent fast reliable would recommend anyone look quality product thank,18
106,4,use phone work totally worth money great place store picture music phone instead use phone memory still run fast,19
107,3,buy two one asus infinity one samsung galaxy s3 international version work fine asus didnt work phone format card use phonethe tablet laptop didnt work test apps use apps nothing show work way get work format canon slr camera,39
108,1,work actual rw speed 188 mbs even class 10 market sandisk basic sandisk ultra unless mean ultra slow 2014 excuse slow card sandisk update redo test notepro 122 instead use non uhsi pc latest result 3286mbs since read speed hit 30 believe device dhsi ready still underwhelmed write speed though,50
109,3,sandisk ultra 32 gb microsdhc c10uhs1 memory card adaptersandisk ultra 32 gb microsdhc c10uhs1 memory card adapterworks fine,18
110,4,great add ton storage smartphone device fast enough need price right,11
111,4,cant possibly go wrong san disc product although purchase son use san disc past never disappoint,16
112,2,job fairly cheap worth return first one exchange another first one defective sandisk really need better quality assurance products second one work perfectly fine use gopro camera,27
113,3,buy sons tablet cartoon videos movies 34all34 game download hes 5 yrs theyll small simple game,16
114,4,buy friend mine put videos initially plug computer couldnt find storage directory however find micro sd usb adapterbingo work like charm install videos plug card phone racesnot sure need adapter couldnt get computer recognize also use linux os go figure,40
115,4,sandisk ultra 64gb micro card great addition maximize samsung galaxy iiis whatever version get 16gb 32gb fast memory great price plenty space picture videos android applications good 1080 videos galaxy iiis use super fast get advance smartphone market memory get right price,42
116,4,instal samsung tablet tab 2 70 definitely performance difference tablet especially load apps,13
117,4,memory work samsung smartphones fast memorysandisk reliable memories market,9
118,4,love good quality good performance great brand could find better product money use samsung galaxy s4 mini zero complications,19
119,4,product arrive two days prime exactly order work great galaxy s3 know class 10 exactly need cell phone cannot hurt right im happy purchase,24
120,4,expand samsung tab 101 tablet 1gb 32gb work fast dont see lag store ten movies tab play right flash disc problemsvery happy card,23
121,4,update provide update regard sandisk supporti buy memory card aug 2012 see original review may 2013 cruise alaska card go bad sail san francisco fine use take panorama shoot golden gate bridge cruise use dslr next time want use cell phone phone tell memory card load way test card laptop get back couldnt recognize contact sandisk via email provide copy receipt amazon along serial number back card hard read problems tell send back card send brand new card still function cell phone great support provide sandisk hassle long provide proof purchase easy since amazon keep entire purchase historyinvoices online one reason buy directly amazon vs vendors either amazon elsewhere internet confidence memory card sell amazon genuine may incredible deal elsewhere internet case deal good true counterfeit card soldoriginal reviewjust receive today remove package insert samsung galaxy s3 verizon power unit back storage available format require work first time settings show 2971gb total space 32gb version 2971gb free space like fact sd adapter come ever need insert card laptop come handy yes plug phone directly laptop ever swap 32gb card phone replace 64gb version use 32gb version via adapter purpose,189
122,2,still dont feel fast phone guess need remove run rw test still ok,13
