,Rating,Review,Length
1955,4,buy soon hear amazon best buy retailers carry time beingit arrive promptly work galaxy note ii flawlessly recommend purchase customers store work regularly try get people aware benefit mass storage small devices,32
1956,4,order san disk ultra 32 gb receive next day via prime problem card defective go thru process return simple receive email replacement send one day delivery get today card good everything perfecti thank,33
1957,4,much say class 10 card cheep price ive month work perfectly old card basic black hc fail year half,19
1958,4,come fast manage get gold box discount seven word require thats cool guess,13
1959,4,32gb mirosd great use phone hardly upload pics phone work faster extra space never worry need delete songspicsor apps,19
1960,4,use memory card galaxy s3 though issue get format correctly phone fault work like dream zero issue,17
1961,4,time much memory use 32gb week vacation didnt even fill ill use one next 32gb brand class speed,18
1962,0,test generic memory card sandisk disappoint buy 32 gig class 10 cardi swear pick original package ship original package return card follow reasonsthese test do use sd card port pcmy generic class 6 32 gig card upload speed 22mb write transfer speed 85my sandisk buy upload speed peak 32mb write transfer speed 65 maybe 85 im luckythe write speed ok transfer speed much low isnt least 10mb 12mb sandisk typically modest classificationsand whats deal classification mark sd card dont see class 10 anywhere cardamazon get back,86
1963,0,first keep unmounting galaxy note 101i get replacedi use replacement galaxy s4 heat phone charge get hot gs4 get hot sd card await second replacement,25
1964,4,class 10 cost wonder today manage 500mb card minutes shoot 1080p video take much space calculate could able record 5 hours 1080p movies 64gb micro sdon hand micro card tiny size one nail miniaturization go long wayin case put gopro 3 camera recognize format immediately issue,46
1965,4,big card great price remember buy 2gb cf card around 200 ago,12
1966,3,buy one sale 35 love itit give surface wiggle roomdont expect read write speed super fast likely computer doesnt support current protocol transfer max speedoverall quality expect sandisk though think price come bite market slowly move away microsd expansion aside samsung,41
1967,4,use action cameras work fine issue tend get around 2hrs film 1080p 30fps 16gb card,15
1968,4,use contour roam race track hasnt fail yet would buy,10
1969,4,work good love,3
1970,4,memory card use wifes tablet upgrade memory maximum storage space problems,11
1971,4,purchase card use new slr camera backup readwrite card fast allow maximum use special modes available camera data transfer speed computer also good real complaints overall good sd card price,30
1972,2,chip work fine fit perfectly tiny fall go hard time find itif application tablet pad 34pushin34 holderyou want put tape secure agent across top chip onto table side think clear finger nail polish would work fine even half drop super glue topi didnt forever go change android ipad satisfy upgrade apple,51
1973,0,piece crap die two months buy iti sure make buy anothergreat,11
1974,4,work flawlessly suppose like speed product adapter case also nice,10
1975,4,3rd sandisk micro sd card 3rd android device like predecessors ultra 64gb micro sdxc class 10 work flawlessly schi605 samsung galaxy note 2i simply insert card powercycled device reboot note 2 recognize unformatted sd card ask would like format order read choose yes additional fully usable micro sd card use media ebook read storagethe response time excellent complaints performancei also love fact order 3pm thanksgiving day alert 3999 price tag,70
1976,4,arrive time everything expectedmore enough cap hold severail hours record,10
1977,0,use samsung galaxy s3 ruin within month second one go phone contact verizon samsung sandisk google read lot forums turn lot people issue phone cardsof course girlfriend throw away card couldnt return dont know issue fix bad batch card go months havent see problem much assume bad batchive another card phone havent issue cant recommend specific card unless issue address,60
1978,4,local storage still necessity really nicetohave cloudconnected worldthese card without sd adapter use mobile phone dslrs computers lenovo y500 ms surface pro tablets asus transformer tf700 nook hd rocksolid 4 dslr theyve prove fast enough burst shoot highdef videoin mobiletabletpcs theyve use shuttle hd videos content back forth without hitchstill love local storage card relatively cheap reliable way achieve,59
1979,4,thing work great store picture videos work perfectly put format hassle best price microsd amazon happy purchase would buy need,20
1980,4,plug surface 2 double storage capacity problems fast enough use videos,11
1981,4,good price work well use galaxy s3 s4 note2 asus tf700 also purchase one spare highly recommend,17
1982,4,able increase storage surface rt carry around external hdd hold enough music library,13
1983,4,add additional storage surface tablet allow storage items want need transport devices,12
1984,4,buy change nook android boot fast reliable daily use,9
1985,4,format fat32 use easy partition home edition free web work samsung galaxy ii phone asus tf101 tabletam gonna buy another one one,22
1986,4,would recommend item anyone look upgrade 64gb memory card whether phone camera,12
1987,4,read many place would work android tablets find card require format windows computer get work even tablets rat 32gb find read write card 64gb need download free partition program format use fat32 first erase current partition repartition 64gb format cant simply use windows format fat32 newer windows computers even older vista max allow 32gb fat32 use partition software bypass 32gb limit format whole card insert tablet read something like 594gb format space huge capacity money fast card search internet format 64gb microsd card android read,85
1988,4,aint technology amaze get card mom buy new smart phone want plenty room picture music movies,16
1989,4,perfect take card put old 32gb card transfer computer samsung galaxy s5 insert samsung galaxy s5 power like never take 32gb card read ringtones program store external sd card everything errors glitches connect phone computer via usb cable usb 3 slot time 75gb music transfer phone read work perfectly could please products work like suppose,55
1990,4,32gb card take smartphone new level recently purchase razrm huge capacity card allow take tons picture even good percentage mp3 collection 9 movies mp4 fast far good far data integrity highly recommend,32
1991,4,pack everything want use tablet onto card take 25gb havent see delay response time whatsoever comfort know massive amount storage space available download picture videos etc thank manufacturer seller exceptional product price,32
1992,4,instal big baby s4 lay night rock roll first test think get 26mb read plenty happy move things onto card also think sure much faster go computer sure faster,29
1993,2,card good havent problem yet good price fit product buy,10
1994,4,already sandisk 16gb class 4 card android phone know faster id press play button music player class 4 always small delay music play 32gb sandisk ultra music play immediately useful way tell fast memory card get approval thank sandisk,39
1995,4,great price great quality fit perfectly device highly recommend brand adapter nice bonus,13
1996,4,fast easy use exactly class 10 suppose use samsung tab 3,11
1997,4,exactly would expect use new galaxy tab disappoint always great product,11
1998,4,ive memory card 4 days order new galaxy s4 verizon work perfectly box didnt format read write speed meet expectations still keep eye card little longer see review report card fail time seem ok menot relevant product get ontrac shippingamazon prime 2 day ship memory card galaxy s4 read many negative review feedback ship company cross finger hop wouldnt something stupid package fortunately get package time nothing damage one minor complain ontrac update track history often allbased purchase phoneless couple days really need phone check track history probably every couple hours show leave faculty 2 12 days update hour get package say go delivery 9am receive package around 5pm get package time problem im ok history ontrac rubbish make worry didnt want phoneless 23 weeks,125
1999,4,compatibility issue memory card even though sdhc backwards compatible throw 32 gb phone extra storage issue make sure move apps phone sd card storage though future proof hide important file want,31
2000,4,simply put 32 gb microsdhc card come mail say would empty get work expect hold file image etc adapter include voila,21
2001,3,buy card hope transition pc smartphone near future use adapter run pc write time arent good hop theyre acceptable overall plenty storage space file music pics sort thing also run portable applications seem perform well part overall solid little card enough speed get majority task donesidenote card come format exfat default onyl way could downgrade fat32 use third party app reason card cant read phone phone older model samsung could issue,71
2002,4,easy load super fast great picture hd video phone really happy purchase dont enough stuff fill,16
2003,4,work great get quickly well pack plug work fine since month speak long term reliability buy another one soon,19
2004,4,buy one note 3 one girlfriend s4 take lot picture lot music phone want extra room card read write quickly also,21
2005,4,figure old microsd card die plug old android phone work antivirus software laptop want scan whole thing every time plug charge constant read wear flash new android phone mount cd drive instead entire thing see phone unmount cd drive perfect charge work careful virus scanners android phone auto mount entire phone micro sd,53
2006,4,chip super fast youre go use android device recommend format ntfs,11
2007,4,reliable brand name produce give lot storage music videos picture tiny one say 1950 would believe,16
2008,4,second one chip receive first either latent physical defect damage transit snap half first use really bum determine try breeze chip blaze double capacity 32 gb chip replace asus tf700t tablet hold music document plenty room leave 128 gb available tablet work flawlesslyanyone look upgrade need little due diligence determine device able address 64 gbs reservation strongly recommend little gem,60
2009,4,hi guy write review three time unfortunately doesnt go amazons websitelolso say tell write read speed fast class 10 great price fast delivery amazonenjoy,24
2010,3,review sandisk ultra 64 gb microsdxc class 10 uhs1 memory card adapter sdsdqu064gaffpathis product arrive via usps individual pack manufacturer place sd case together adapter unable verify warranties authenticity samsung s3 recognize format problem see external memory 59gb six gb probably allocate fatfile allocation table order seller,47
2011,0,get card especially plan use android phone google sd card unexpectedly remove find problem cause directly card purchase different brand problem immediately disappear curiosity try mount card windows pc rare occasion sd card turn empty remove problem limit android would avoid card completely,43
2012,4,dont know exactly say little micro seem least efficient micro ive ever use,13
2013,3,things suppose work flawlessly arent anyway didnt need format s4 go straight probs,13
2014,4,work great use s3 take hd movies store music bla,10
2015,4,complain use card weeks problems please,6
2016,4,1616gb32gb last long time waaaaaaay cheaper 32gb version s3ip4sip5 highly recommend get 32gb 48gb total,15
2017,4,describe havent issue far put samsung tablet work expect standard format,11
2018,2,update 61814 well suppose nothing last forever almost year card go bad use card lot smartphone tmobile samsung galaxy s3 sght999 photos voice record download go card download transfer computer almost daily via usb cable days ago video file transfer computer refuse play correctly video audio skip squeal recognize sound corrupt file think maybe transfer didnt complete try result try play file right phone didnt play phone know problem try copy video phone storage play still luck delete video decide download directly phone sd card eureka play perfectlyi format sdxc card twice phone windows try test download video file card phone result time wouldnt play sd card phone videos use play perfectly sd card finally swap card older sandisk ultra 32gb micro sdxc card like magic work perfectly matter play yeah 64gb card dead note card perform flawlessly nearly year days agothankfully sandisk ultra products like carry incredible lifetime warranty 10 years regions dont recognize lifetime extreme line card raise 30 years ive contact support rma ill update review events unfold replace quickly ill bump back 5 starsoriginal reviewim use samsung galaxy s3 smartphone sandisk ultra micro sd card never fail ones exception use 32gb card theyre fast reliable never corrupt data say cheaper brand like pny fail quite often cant wait get new 128gb model,216
2019,3,use android phone work fine decently fast quite reach rat speed come close could controller use,16
2020,3,buy three theseone replace old 1 gb card two firsttime users add phone memory card work fine none three trouble,20
2021,3,32 gb sufficient dont need thisrunning easy safety sandisk great mark,11
2022,4,always use sandisk first option get gopro fast goodcant say much sandisk make best card period,16
2023,4,top performance always good luck sandisk base past experience 34namebrand34 saw reason hesitantpast experience pay happy purchase,17
2024,4,get sandisk 32gb get full 23gb free almost fill one months 17gb free start need new sandisk 128gb need money storage use without problems come s4 treat nice get decent speed 1015mbs transfer hate wait gb 1080p footage transfer guess would rather storage speed would recommend anyone need high storage cheap price,52
2025,4,good price never issue card decide stop record use hero3 3 always record 1080p 60fps,15
2026,4,good buy card need tablet super fast spead load load pc laptop fast,13
2027,4,buy 2 gsiiis issue fast read write price right big surprise another quality product sandisk,15
2028,0,buy costco black friday deal start use couple days ago today transfer video file phone card wasnt able stop half way nothing write itit purchase costco fake microsdhc card test authenticity app google play verify real still piece junk sandisk reputationi would advise shopper choose brand surely cheap would rather lose important file store,54
2029,4,sandisk never disappoint 64gin microdisk thing super fast use new galaxy note 2 amaze,14
2030,4,memory card hold ton information use video hold 1080p videos like champ,12
2031,4,update 6192014 lovely wife buy samsung galaxy tab 4 father day ive love ever since samsung products galaxy tab 4 ability add microsd card expand memory device since year decide research see sandisk offer anything new 6192014 product lineup microsd card worst best performancewise followssandisksandisk ultrasandisk ultra plussandisk extremesandisk extreme plussandisk extreme pronow difference card simply speed readwrite data card yes publish rat card except sandisk regular class 10uhsi thats rat actual real world performance get better model faster card come expensive price since amazon doesnt carry ultra plus model microsd card direct comparisons sandisk ultra 3427 extreme 5795 extreme plus 6795as mention earlier review purchase sandisk ultra galaxy s4 question want pay 20 card faster one already own could pay almost double get sandisks 2ndmost fastest microsd cardthe ultra work perfectly fine style usage storingcapturing picture hd video movie playback phone end end buy another sandisk ultra 64gb card use cell phone tablet card good enough phone good enough tablet dont 4k hd camera anything like honestly didnt see need get one faster card timei proud owner 2 sandisk ultra card absolutely 0 issue samsung devices original review 512013 havent buy microsd card long time last time buy one cell phone 2 years ago since cellular contract know would get newer card addition new phone samsung galaxy s4 reason know small 16gb microsd card wasnt go cut itdoing research galaxy s4 want get best card possible decent capacity 32 gb greater lead find galaxy s4 support microsdxc class 10 uhsi card fastest possible give class search specifically amazon give result 3 vendors april make microsdxc class 10 uhs1 card sandisk majority samsung lexar nobody else make sell amazonseeing sandisk pretty good name 3 ive use decide upon sandisk lexar overprice samsung one overprice well eligible amazon primebut scary thing filter sandisk literally get dozens options different model number different size etc theres confusion whats difference sdhc sdxcsdhc vs sdxcsdhc stand secure digital high capacity sdxc stand secure digital extend capacity essentially two card exception sdhc support capcities 32gb format fat32 file system sdxc card format exfat file system use sdxc card device must support file system otherwise may recognizable andor reformat card fat32fat32 vs exfatthe differences two file systems mean fat32 maximum file size 4gb limit file system exfat otherhand support file size 2tb terabytes thing need know really possible device doesnt support exfat thats case reformat fat32 remember format erase datato clarify model number hop sandisk official webpage find offer two highspeed options sandisk card sandisk extreme pro sandisk ultra sandisk extreme pro line support read speed 95mbsec however sdhc make things worse currently available 16gb 8gb capacities since one requirements lot storage rule outthe remain devices list amazons search sandisk ultra line confusion set sandisk separate card two different devices cameras mobile devices real difference two market stunt unfortunately im sure know price difference two range couple cents dollars since wasnt sure opt one specifically target mobile devices case kind compatibility issue find exact model number would go sandisks webpage sandiskcom compare exist product lineup get exact model number search amazon model number get mine sdsdqua064gas speed test havent run specific test copy 8 gb worth data pc card literally take minutesone last note amazon attach additional character end example sdsdqua064gaffpa vs sdsdqua064gu46a difference two affpa mean amazon frustration free package exactly youre wonder get want use galaxy s4 get sdsdqua064gu46a work like charm,567
2032,4,insert little gem new nook hd let tell youwow love much wont give back instead buy larger capacity tabletsjust buy smallest amount gigs buy one little dudes,27
2033,4,buy one tablet well fast durable long last recommend itemso get one,12
2034,4,wish come sort usb converter transfer file faster pc use samsung galaxy note 2 file transfer speed mediocre,18
2035,4,purchase go pro hero 3 solid card unless plan buy several would recommend go 64 gig higher capture set get little hour video time,24
2036,3,standard come high capacity mobile memory grate older android phone older tablet probably wont see much difference modern device like galaxy s4 note 3 equivalent mobile device youll definitely notice difference data transfer access device modern phone uhs1 memory card must reason didnt give product five star sandisk extreme sandisk extreme pro must extremely specific need want get 85mbs transfer speed mobile device movies music apps one adequate,68
2037,4,buy use gopro hero 3 silver complaints trhgtr thth h r,11
2038,4,work great faster conventional memory card videos picture access run smoother highly recomnended need great space,16
2039,4,buy sony action cam give 8 hours video use 1080 30 fps,12
2040,4,question really fast rat fast well class 3410 sdhc34 mean literally sd format hchigh capacity class 10 10mbsec readwrite fast 10mb per second well class 4 common step ie cheaper class 4 ie 4mbsec class 10 25 time faster pay differencedigital cameras point number picturessec hd video bottleneck speed media record tosmart phone samsung note ii quadcore processor wizbang yaddayadda yes notice speed differences camera app performance use spreadsheet appbrowsernetflixmusic stream et al noticeably faster think phone store stuff doesnt use factory instal memory iphomes dont sd slot wouldnt phone tablet doesnt believe choice computer realmoh yeah sandisk leader pioneer sd format think sd come sdhc class 10 card worthy comparison samsung brand might bias one,116
2041,4,use card galaxy s3 problems tonsoroom ever want,8
2042,0,small preasure try remove device get brokenalso io speed amaze even class 10,13
2043,4,soon get pop back samsung galaxy note 2 put note 2 recognize instantly able move mp3s internal memory external memory play music short order,24
2044,4,love memory card use galaxy 2 smartphone couldnt happier fast take photos phone doesnt stutter like old memory card definive must buy power user afford,25
2045,3,great price work great samsung galaxy s4such relief worry space pix apps,12
2046,3,definitely sandisk ultra 32 gb microsdhc c10uhs1 memory card adapter sdsdqu032gaffpa work advertise im definitely happy product price definitely worth,20
2047,4,get great pricebut speed reliability strenghts thing use gn 80 perform,11
2048,4,problem rat review item one work experience sandisk memory card work take beat wash else ask,16
2049,4,get gopro black edition record 45 hours video highest set please performance far errors failures,15
2050,3,buy use phone expand memory 32gb gs3 want double memory phone wasnt sure phone would take 32gb card im happy product also love easyopen cardboard package like easier open ship mostly like plastic since hate excess trash put landfills,39
2051,1,assume brand new 64gb sandisk ultra class 10 sdxc card responsible occasional video record stutterpausing happen since start use today prior never issue previous sandisk sdhc card today maiden trip lead video 35 minutes long several performance issue default attribute card since nothing else change ive never issue four months ive galaxy note 2 problems format card though installingusing otherwise,60
2052,3,great product work perfectly canon camcorder responsive fastenough capacity 8 hours video great price grab thanksgiving 2012,17
2053,4,ton storage fast transfer speed much say use samsung vibrant nexus 4,12
2054,4,sd card great note 3 work perfectly almost half year would recommend everyone,13
2055,3,good price good size micro sd fastese card use price satisfy,11
2056,4,overall good memory card fast even come adapter fit camera perfectly picture take breeze would recommmend others,17
2057,4,instal item dell venue 8 pro work fine house program im happy device,13
2058,3,complaints yetit come adapter advertise wish purchase two instead one,10
2059,4,max storage phone fastest class available decent 128 card available right bad price either,14
2060,3,great product reasonable price increase galaxy tab 2 memory useability without deal interface cable,14
2061,3,like good product next time order bigger memory recomend product friends,11
2062,0,start unmounting remount really suck battery life quick google search show common problem oh well,15
2063,3,phone galaxy s3 virgin still get sd card unexpectedly remove know issue phone card,14
2064,3,perfect hd video production hold lot still videos reasonable write speed complaints,12
2065,4,great micro sd card 35 extremely cheap get 2 thoses ive never look back uhs1 fast,16
2066,4,sandisk ultra 32 gb microsdhc c10uhs1 memory card adapter really work like suppose order another soon,16
2067,4,soon insert samsung galaxy s4 start get fill trip nyc great empty photos music phone phone still work fast good consider sd card apps tend make android phone slow great quality sandisk,32
2068,4,card make good company work well lightning fast get job do memory card really much talk fact hold info access store info fast,23
2069,4,sandisk 16 microsdhc work perfec want usedi use videos musicdefinitaly recommend,11
2070,4,come right price ship quickly store many extra things phone,10
2071,4,excellent delivery time memory feel read write pretty fast previous experience class 4 16gb micro sd lot faster,18
2072,4,put memory card microsoft surface rt work fantastic format setup ready go right bat plus price best could find anywhere,20
2073,4,purchase card use helmet mount video camera memory card correctly state previous reviewer even card rat class number dont perform card perform well subzero temperatures catch ski action also high speed fly action southern ca high temperatures black camera measure actual data speed capture 1080p hd 30fps video camera without issuesoverall card good value perform well would recommend,58
2074,4,buy grand daughters camera 64gb memory refuse work windows tablet swap one work splendidly,14
2075,1,32gb galaxy s3 almost three months issue however phone recently start tell card unrecognized file empty cause loss media choose format see error long chalk random error somehow yesterday file card magically reappear able play music despite phone format card shortly afterwards error reappear put card computer simply appear shame think risky card purchase,54
2076,4,far problems memory transfer speed good work great samsung note 8,11
2077,4,add really nice support memory device enjoy worry run space,10
2078,4,normally buy sandisk extreme gopro decide try ultra save money far seem work good try shoot 4k yet although seem like would work,23
2079,4,device work galaxy s4 problems woks perfectly really cant get buy 64gb storage device size thumbnail run program 50one day something like hold 64 tb crazy cool,27
2080,4,screw orignally order wrong card need card quickly trip order arrive put tablet andloaded file work flawlessly month nowthanks,19
2081,4,recent map update garmin gps run memory map get detail use memory get back full north america map cam adapter fit pc sd slot,24
